{
  "format": "p4-cart-source-v1",
  "game": {
    "id": "13f70d5f-04c5-4a80-a604-695ed3841562",
    "slug": "qr-dodge",
    "title": "QR Dodge",
    "version": "1.0.0",
    "summary": "Dodge falling blocks in a compact p4.arcade example.",
    "category": "ARCADE",
    "players": {
      "min": 1,
      "max": 1
    }
  },
  "runtime": {
    "id": "p4-lua-5.4-v1",
    "api": 1,
    "entry": "main.lua",
    "logical_width": 768,
    "logical_height": 480,
    "update_hz": 60,
    "present_hz": 30,
    "heap_bytes": 65536,
    "save_bytes": 0,
    "capabilities": [
      "audio-tone",
      "draw",
      "input"
    ]
  },
  "license": {
    "code": "MIT",
    "assets": "CC0-1.0",
    "notice": "LICENSES/NOTICE.txt"
  },
  "remix": {
    "source_included": true,
    "parent": null
  },
  "files": [
    {
      "path": "LICENSES/NOTICE.txt",
      "kind": "license"
    },
    {
      "path": "README.md",
      "kind": "documentation"
    },
    {
      "path": "main.lua",
      "kind": "runtime-source"
    }
  ]
}
